{
  "$schema": "./schema-layout.json",
  "name": "Example Layout",
  "slug": "example-layout",
  "description": "Copy this into layouts/<your-slug>.json. Pick a base layout and arrange the sections.",
  "tags": ["example", "starter"],
  "layout": {
    "base": "ADVANCED",
    "sections": [
      { "key": "stats",  "visible": true,  "detailLevel": "compact",  "order": 10 },
      { "key": "games",  "visible": true,  "detailLevel": "detailed", "order": 20 },
      { "key": "anime",  "visible": true,  "detailLevel": "detailed", "order": 30 },
      { "key": "genres", "visible": true,  "detailLevel": "compact",  "order": 40 },
      { "key": "discord","visible": true,  "detailLevel": "detailed", "order": 50 }
    ]
  }
}
